cui,cui_name,curated_name,hpo,hpo_name
C0160871,"Other and unspecified superficial injury of hand(s) except finger(s) alone, without mention of infection"," and  superficial injury of hand(s) except finger(s) alone, ",,
C1370824,Interstitial emphysema,interstitial emphysema,,
C0476476,Generalized hyperhidrosis,generalized hyperhidrosis,,
C0392477,Congenital flat foot,congenital flat foot,,
C0392470,Anomalous atrioventricular excitation,anomalous atrioventricular excitation,,
C0235660,Galactorrhea not associated with childbirth,galactorrhea not associated ,,
C0375146,"Diabetes with other specified manifestations, type I [juvenile type], not stated as uncontrolled",diabetes ,,
C0345205,"Atresia and stenosis of large intestine, rectum and anal canal (disorder)","atresia and stenosis of large intestine, rectum and anal canal (disorder)",,
C0520578,Retractile testis,,HP:0012646,Retractile testis
C0013240,Alveolar periostitis,alveolar periostitis,,
C0270549,Generalized Anxiety Disorder,generalized anxiety disorder,,
C0155311,Disorder of optic chiasm associated with inflammatory disorder,disorder of optic chiasm associated ,,
C0029601,Other respiratory abnormalities, respiratory abnormalities,,
C0158968,Other perinatal jaundice, perinatal jaundice,,
C0243026,Sepsis,sepsis,,
C0034103,Pulpitis,pulpitis,,
C0154773,Acute endophthalmitis,acute endophthalmitis,,
C0023212,Left-Sided Heart Failure,,HP:0005162,Left ventricular failure
C0030286,Pancreatic Diseases,pancreatic diseases,,
C0158829,Other forms of placental separation and hemorrhage affecting fetus or newborn, forms of placental separation and hemorrhage affecting fetus or newborn,,
C0155508,Viral labyrinthitis,viral labyrinthitis,,
C0158820,Fetus or newborn affected by polyhydramnios,fetus or newborn affected by polyhydramnios,,
C0155502,Benign Paroxysmal Positional Vertigo,benign paroxysmal positional vertigo,,
C0158825,Other specified maternal complications of pregnancy affecting fetus or newborn, specified maternal complications of pregnancy affecting fetus or newborn,,
C0477914,Other apnea of newborn, apnea of newborn,,
C0338632,Dementia associated with another disease,dementia associated ,,
C0155764,Unspecified disorders of arteries and arterioles, disorders of arteries and arterioles,,
C0155763,Other specified disorders of arteries and arterioles, specified disorders of arteries and arterioles,,
C0004045,Asphyxia Neonatorum,,HP:0012768,Neonatal asphyxia
C0004044,Asphyxia,asphyxia,,
C0024622,Malignant neoplasm of retina,malignant neoplasm of retina,,
C0024624,"Malignant neoplasm of upper lobe, bronchus or lung","malignant neoplasm of upper lobe, bronchus or lung",,
C1704330,Dental Diseases,dental diseases,,
C0242855,Congenital atresia of pulmonary valve,,HP:0010882,Pulmonary valve atresia
C1456316,"Anxiety, dissociative and somatoform disorders","anxiety, dissociative and somatoform disorders",,
C1456315,Other isolated or specific phobias, isolated or specific phobias,,
C1456313,Other specified pervasive developmental disorders, specified pervasive developmental disorders,,
C1456311,Other and unspecified episodic mood disorder, and   depression,,
C1456310,Other specified episodic mood disorder, specified  depression,,
C0375707,Anaphylactic shock due to tree nuts and seeds,anaphylactic shock due to tree nuts and seeds,,
C0375703,Anaphylactic shock due to unspecified food,anaphylactic shock due to  food,,
C2231358,severe socialized conduct disorder,severe socialized oppositional defiant disorder,,
C0375700,nutritional child neglect,nutritional child neglect,,
C1260391,Iatrogenic carnitine deficiency,iatrogenic carnitine deficiency,,
C0036278,Scar conditions and fibrosis of skin,scar conditions and fibrosis of skin,,
C0376175,Bell Palsy,,HP:0010628,Facial palsy
C0311334,Generalized convulsive epilepsy,generalized convulsive epilepsy,,
C0159883,Closed trimalleolar fracture,closed trimalleolar fracture,,
C0159884,Open trimalleolar fracture,open trimalleolar fracture,,
C0343065,Symptomatic dermographism,,HP:0011971,Dermatographic urticaria
C0152239,Congenital bronchiectasis,congenital bronchiectasis,,
C0152236,Talipes valgus,,HP:0004684,Talipes valgus
C0152237,Talipes Calcaneovalgus,,HP:0001884,Talipes calcaneovalgus
C0042075,Urologic Diseases,urologic diseases,,
C0311338,Fundus Albipunctatus,,HP:0030642,Fundus albipunctatus
C0152230,Cholinergic urticaria,cholinergic urticaria,,
C0153012,Other enterovirus diseases of central nervous system, enterovirus diseases of central nervous system,,
C0153017,Varicella Zoster Encephalitis,varicella zoster encephalitis,,
C1561889,Other organic sleep related movement disorders, organic sleep related movement disorders,,
C0153018,Hemorrhagic varicella pneumonitis,hemorrhagic varicella pneumonitis,,
C1561882,Organic parasomnia,organic parasomnia,,
C0264776,Rheumatic tricuspid valve disease,rheumatic tricuspid valve disease,,
C0264774,Mitral and aortic incompetence,mitral and aortic incompetence,,
C0600040,Chronic interstitial cystitis,chronic interstitial cystitis,,
C1719672,Severe Sepsis,severe sepsis,,
C0022661,"Kidney Failure, Chronic","kidney failure, chronic",,
C0022660,"Kidney Failure, Acute","kidney failure, acute",,
C0685925,Articular disc disorder of temporomandibular joint,articular disc disorder of temporomandibular joint,,
C0156088,Gastroptosis,gastroptosis,,
C2349312,"Unspecified leukemia, without mention of having achieved remission"," leukemia, ",,
C0158599,Preauricular cyst,preauricular cyst,,
C0158598,Preauricular sinus and fistula,preauricular sinus and fistula,,
C0160407,Unspecified injury to spleen without mention of open wound into cavity, injury to spleen ,,
C0013146,Drug abuse,drug abuse,,
C0156082,"Unspecified gastritis and gastroduodenitis, with hemorrhage"," gastritis and gastroduodenitis, ",,
C0160409,"Injury to spleen without mention of open wound into cavity, capsular tears, without major disruption of parenchyma",injury to spleen ,,
C0013415,Dysthymic Disorder,dysthymic disorder,,
C0016644,Fracture of carpal bone,fracture of carpal bone,,
C0008039,Cheyne-Stokes Respiration,,HP:0012196,Cheyne-Stokes respiration
C0012546,Diphtheria,diphtheria,,
C0029570,Other deficiencies of circulating enzymes, deficiencies of circulating enzymes,,
C0029571,Other degenerative diseases of the basal ganglia, degenerative diseases of the basal ganglia,,
C0029579,OTHER LUNG DISEASE NEC in ICD9CM, lung disease,,
C0260673,Eye globe replaced by other means,eye globe replaced by  means,,
C0158045,"Arthropathy unspecified, involving upper arm","arthropathy , involving upper arm",,
C0260676,Blood vessel replaced by other means,blood vessel replaced by  means,,
C0260675,Heart valve replaced by other means,heart valve replaced by  means,,
C0158049,"Arthropathy unspecified, involving lower leg","arthropathy , involving lower leg",,
C0158048,"Arthropathy, unspecified, pelvic region and thigh","arthropathy, , pelvic region and thigh",,
C0271086,Toxic maculopathy,toxic maculopathy,,
C0155675,Pulmonary Arteriovenous Fistulas,,HP:0004952,Pulmonary arteriovenous fistulas
C0431826,Transverse deficiency of upper limb,transverse deficiency of upper limb,,
C0156993,"Other fetal abnormality causing disproportion, unspecified as to episode of care or not applicable"," fetal abnormality causing disproportion,  as to episode of care or ",,
C0156991,"Hydrocephalic foetus causing disproportion, antepartum","hydrocephalic foetus causing disproportion, antepartum",,
C0158100,Recurrent joint dislocation,recurrent joint dislocation,,
C0029717,Other psoriasis and similar disorders, psoriasis and similar disorders,,
C0029712,Other premature beats, premature beats,,
C0158105,"Recurrent dislocation of joint, pelvic region and thigh","recurrent dislocation of joint, pelvic region and thigh",,
C0158108,"Recurrent dislocation of joint, other specified sites","recurrent dislocation of joint,  specified sites",,
C0409667,Juvenile Chronic Polyarthritis,juvenile chronic polyarthritis,,
C0007933,Meibomian Cyst,,HP:0010605,Chalazion
C0020532,Hypersplenism,,HP:0001971,Hypersplenism
C0375288,cerebral embolism with cerebral infarction,cerebral embolism ,,
C0020534,Orbital separation excessive,,HP:0000316,Hypertelorism
C0375283,Occlusion and stenosis of unspecified precerebral artery without mention of cerebral infarction,occlusion and stenosis of  precerebral artery ,,
C0020538,Hypertensive disease,,HP:0000822,Hypertension
C0375286,Cerebral thrombosis with cerebral infarction,cerebral thrombosis ,,
C0375284,Occlusion and stenosis of unspecified precerebral artery with cerebral infarction,occlusion and stenosis of  precerebral artery ,,
C0375285,Cerebral thrombosis without mention of cerebral infarction,cerebral thrombosis ,,
C0154598,Other specified nonpsychotic mental disorders following organic brain damage, specified nonpsychotic mental disorders following organic brain damage,,
C0270932,Paraneoplastic Polyneuropathy,paraneoplastic polyneuropathy,,
C0265647,Congenital metatarsus varus,congenital metatarsus varus,,
C0266592,Congenital anomaly of ear with impairment of hearing,congenital anomaly of ear ,,
C0266846,Dental caries extending into dentin,dental caries extending into dentin,,
C0154378,"Schizo-affective type schizophrenia, chronic state with acute exacerbation"," schizophrenia, chronic state ",,
C0262030,Assault by other specified means,assault by  specified means,,
C2240397,Other effects of external causes NEC, effects of external causes nec,,
C1442952,Brachial neuritis or radiculitis NOS,brachial neuritis or radiculitis nos,,
C0024433,Macrostomia,,HP:0000154,Wide mouth
C0348774,Other problems related to lifestyle, problems related to lifestyle,,
C1456142,"Pressure ulcer, other site","pressure ulcer,  site",,
C0010054,Coronary Arteriosclerosis,,HP:0004929,Coronary atherosclerosis
C0033036,Atrial Premature Complexes,,HP:0006699,Premature atrial contractions
C1456147,"Excessive attrition, unspecified","excessive attrition, ",,
C0010051,Coronary Aneurysm,coronary aneurysm,,
C0340797,Vascular malformation peripheral,vascular malformation peripheral,,
C0152214,Intermittent alternating exotropia,intermittent alternating exotropia,,
C1281729,Current tear of medial cartilage AND/OR meniscus of knee,current tear of medial cartilage and/or meniscus of knee,,
C0160679,Injury of blood vessels of head AND/OR neck,injury of blood vessels of head and/or neck,,
C0477458,Other specified hearing loss, specified hearing loss,,
C0156238,"Nephritis and nephropathy, not specified as acute or chronic, with lesion of renal cortical necrosis","nephritis and nephropathy, not specified as acute or chronic, ",,
C0156230,nephrotic syndrome in diseases classified elsewhere,nephrotic syndrome in diseases classified elsewhere,,
C0432918,"Blister of foot and toe(s), without mention of infection","blister of foot and toe(s), ",,
C0158694,"anomalies of cervix, vagina, and external female genitalia","anomalies of cervix, vagina, and external female genitalia",,
C0158698,Congenital malformation of the urinary system,congenital malformation of the urinary system,,
C0158699,Renal agenesis and dysgenesis,renal agenesis and dysgenesis,,
C0033698,Proteus (mirabilis) (morganii) infection in conditions classified elsewhere and of unspecified site,proteus (mirabilis) (morganii) infection in conditions classified elsewhere and of  site,,
C0154956,Glaucoma associated with systemic syndromes,glaucoma associated ,,
C0032617,Polyuria,,HP:0000103,Polyuria
C0154953,Glaucoma associated with chamber angle anomalies,glaucoma associated ,,
C1961121,Congenital vascular anomaly,congenital vascular anomaly,,
C0035344,Retinopathy of Prematurity,retinopathy of prematurity,,
C0375519,Upper limb vessel congenital anomaly,upper limb vessel congenital anomaly,,
C0153461,Malignant neoplasm of pancreatic duct,malignant neoplasm of pancreatic duct,,
C0153465,Malignant retroperitoneal tumor,malignant retroperitoneal tumor,,
C0338982,Other specific developmental learning difficulties, specific developmental learning difficulties,,
C0338984,Residual infantile autism,residual  autism,,
C0274354,Mechanical complication due to corneal graft,mechanical complication due to corneal graft,,
C0274356,mechanical complication due to ocular lens prosthesis,mechanical complication due to ocular lens prosthesis,,
C0160893,"Other and unspecified superficial injury of hip, thigh, leg, and ankle, without mention of infection"," and  superficial injury of hip, thigh, leg, and ankle, ",,
C0160890,"Insect bite, nonvenomous of hip, thigh, leg, and ankle, infected","insect bite, nonvenomous of hip, thigh, leg, and ankle, infected",,
C0160895,Superficial injury of foot and toe(s),superficial injury of foot and toe(s),,
C0476414,Thyroid function tests abnormal,thyroid function tests abnormal,,
C2349815,Overexertion and strenuous and repetitive movements or loads,overexertion and strenuous and repetitive movements or loads,,
C0475686,H/O: leukemia,h/o: leukemia,,
C0206504,Tympanic Membrane Perforation,tympanic membrane perforation,,
C0154167,Other specified disorders of thyroid, specified disorders of thyroid,,
C0154160,Other iatrogenic hypothyroidism, iatrogenic hypothyroidism,,
C0154161,Other specified acquired hypothyroidism, specified acquired hypothyroidism,,
C0520556,Pilonidal cyst without abscess,pilonidal cyst ,,
C0494350,Cystic fibrosis with other manifestations,cystic fibrosis ,,
C0260334,Pneumonitis due to inhalation of food or vomitus,pneumonitis due to inhalation of food or vomitus,,
C0154788,Blind hypotensive eye,blind hypotensive eye,,
C0154782,Primary hypotony of eye,primary hypotony of eye,,
C0154783,Ocular fistula causing hypotony of eye,ocular fistula causing hypotony of eye,,
C0158357,Postoperative heterotopic calcification,postoperative heterotopic calcification,,
C0155567,Rheumatic aortic stenosis,rheumatic aortic stenosis,,
C0158846,Fetus and newborn affected by abnormal uterine contractions,fetus and newborn affected by abnormal uterine contractions,,
C0338886,"Major depressive affective disorder, single episode, in partial or unspecified remission","major depressive affective disorder, , ",,
C0439002,Congenital absence of muscle AND/OR tendon,congenital absence of muscle and/or tendon,,
C0153928,"Other leukemia of unspecified cell type, in remission"," leukemia of  cell type, in remission",,
C0019570,Hirschsprung's disease and other congenital functional disorders of colon,hirschsprung's disease and  congenital functional disorders of colon,,
C0041893,Unspecified ventral hernia without mention of obstruction or gangrene, ventral hernia ,,
C0155788,Residual hemorrhoidal skin tags,residual hemorrhoidal skin tags,,
C3251816,Thoracic aortic aneurysm without rupture,thoracic aortic aneurysm ,,
C0411169,Fetus and newborn affected by multiple pregnancy,fetus and newborn affected by multiple pregnancy,,
C0859673,Unspecified hereditary and idiopathic peripheral neuropathy, hereditary and  peripheral neuropathy,,
C0677577,"Dwarfism, NEC in ICD9CM_2014","dwarfism,",,
C0161441,Injury to unspecified site of nerve roots and spinal plexus,injury to  site of nerve roots and spinal plexus,,
C0161446,Injury of brachial plexus,injury of brachial plexus,,
C0161118,"Blisters, epidermal loss [second degree] of chest wall, excluding breast and nipple","blisters, epidermal loss [second degree] of chest wall, excluding breast and nipple",,
C0152032,Urinary hesitation,,HP:0000019,Urinary hesitancy
C0221539,Transient alteration of awareness,transient alteration of awareness,,
C0153253,Candidiasis of other specified sites,candidiasis of  specified sites,,
C0153252,Systemic candidiasis,systemic candidiasis,,
C0153250,Candidiasis of other urogenital sites,candidiasis of  urogenital sites,,
C0153256,Candidal meningitis,candidal meningitis,,
C0375723,Other nervous system complications, nervous system complications,,
C0375722,Iatrogenic cerebrovascular infarction or hemorrhage,iatrogenic cerebrovascular infarction or hemorrhage,,
C0375729,Other postoperative infection, postoperative infection,,
C0375728,Infected postoperative seroma,infected postoperative seroma,,
C0158280,Spinal stenosis in cervical region,spinal stenosis in cervical region,,
C0018621,Hay fever,,HP:0012395,Seasonal allergy
C1719381,Other acquired torsion dystonia, acquired torsion dystonia,,
C1719382,Acquired torsion dystonia,acquired torsion dystonia,,
C0410740,Acquired deformity of finger,,HP:0004097,Deviation of finger
C1719389,acute pain due to trauma,acute pain due to trauma,,
C0343047,Complement component 5 deficiency,complement component 5 deficiency,,
C0152256,Disuse osteoporosis,disuse osteoporosis,,
C0152251,Toxic erythema,toxic erythema,,
C0152253,Posterior synechiae,,HP:0011484,Posterior synechiae of the anterior chamber
C0348098,Other viral enteritis, viral enteritis,,
C1719651,Tumour marker abnormal,tumour marker abnormal,,
C0160245,"Subdural hemorrhage following injury without mention of open intracranial wound, with concussion, unspecified",subdural hemorrhage following injury ,,
C0022602,Actinic keratosis,actinic keratosis,,
C0001539,Adjustment disorder with depressed mood,adjustment disorder ,,
C0160427,Injury to kidney with open wound into cavity,injury to kidney ,,
C0153785,"Hodgkin's disease of lymph nodes of head, face AND/OR neck","hodgkin's disease of lymph nodes of head, face and/or neck",,
C0016667,Fragile X Syndrome,fragile x syndrome,,
C0016665,"Fractures, Ununited","fractures, ununited",,
C0016663,Pathological fracture,,HP:0002756,Pathologic fracture
C0012569,Diplopia,,HP:0000651,Diplopia
C0029557,Other congenital deformity of hip (joint), congenital deformity of hip (joint),,
C0029554,"Other anomalies of gallbladder, bile ducts, and liver"," anomalies of gallbladder, bile ducts, and liver",,
C0029552,Other congenital anomalies of anterior segment, congenital anomalies of anterior segment,,
C0029553,"Other anomalies of cervix, vagina, and external female genitalia"," anomalies of cervix, vagina, and external female genitalia",,
C0029550,Other conditions due to sex chromosome anomalies, conditions due to sex chromosome anomalies,,
C0029551,Other conditions of brain, conditions of brain,,
C0158065,"Internal derangement of knee, other","internal derangement of knee, ",,
C0393939,Neuromuscular Junction Toxic Disorders,neuromuscular junction toxic disorders,,
C0158061,Derangement of posterior horn of lateral meniscus,derangement of posterior horn of lateral meniscus,,
C0158060,Derangement of anterior horn of lateral meniscus,derangement of anterior horn of lateral meniscus,,
C0029559,Other osteodystrophies, osteodystrophies,,
C0153312,Toxoplasmosis of other specified sites,toxoplasmosis of  specified sites,,
C0009677,Congenital macroglossia,congenital macroglossia,,
C0856761,Budd-Chiari Syndrome,,HP:0002639,Budd-Chiari syndrome
C2712707,Voice and resonance disorders,voice and resonance disorders,,
C0344304,Generalized abdominal pain,generalized abdominal pain,,
C0029730,"Rheumatic heart disease, other and unspecified","rheumatic heart disease,  and ",,
C0029737,Other shock without mention of trauma, shock ,,
C0029734,Other scleritis and episcleritis, scleritis and episcleritis,,
C0432340,Specified anomalies of hair,specified anomalies of hair,,
C0838226,"Pain in a joint, pelvic region and thigh","pain in a joint, pelvic region and thigh",,
C0838227,Pain in joint involving lower leg,pain in joint involving lower leg,,
C0838224,Pain in joint involving forearm,pain in joint involving forearm,,
C0838222,Pain in joint involving shoulder region,pain in joint involving shoulder region,,
C0838223,Pain in joint involving upper arm,pain in joint involving upper arm,,
C0018800,Cardiomegaly,,HP:0001640,Cardiomegaly
C0029593,Other disorders of neurohypophysis, disorders of neurohypophysis,,
C0023066,Laryngismus,,HP:0006511,Laryngeal stridor
C1455968,Contact with or exposure to varicella,contact ,,
C0375267,Other pulmonary embolism and infarction, pulmonary embolism and infarction,,
C0375268,Acute endocarditis,acute endocarditis,,
C0155907,Spontaneous tension pneumothorax,spontaneous tension pneumothorax,,
C0154573,Other specific disorders of sleep of nonorganic origin, specific disorders of sleep of nonorganic origin,,
C0154571,Other dysfunctions of sleep stages or arousal from sleep, dysfunctions of sleep stages or arousal from sleep,,
C0155906,"Pleurisy with effusion, with mention of a bacterial cause other than tuberculosis",pleurisy ,,
C0154575,Rumination Disorders,rumination disorders,,
C0158285,Unspecified musculoskeletal disorders and symptoms referable to neck, musculoskeletal disorders and symptoms referable to neck,,
C0154579,Predominant disturbance of consciousness,predominant disturbance of consciousness,,
C0154578,Predominant disturbance of emotions,predominant disturbance of emotions,,
C0155900,Pneumonitis due to other solids and liquids,pneumonitis due to  solids and liquids,,
C0155956,Atrophy of salivary gland,atrophy of salivary gland,,
C0155957,Abscess of salivary gland,abscess of salivary gland,,
C0155954,Inflammatory conditions of jaws,inflammatory conditions of jaws,,
C0155952,Retained dental root,retained dental root,,
C0158287,Spinal stenosis of thoracic region,spinal stenosis of thoracic region,,
C0477891,"Fetus and newborn affected by other malpresentation, malposition and disproportion during labor and delivery","fetus and newborn affected by  malpresentation, malposition and disproportion during labor and delivery",,
C0155674,Other diseases of pulmonary circulation, diseases of pulmonary circulation,,
C0155958,"Diseases of the oral soft tissues, excluding lesions specific for gingiva and tongue","diseases of the oral soft tissues, excluding lesions specific for gingiva and tongue",,
C0155959,Cyst of oral soft tissue,cyst of oral soft tissue,,
C2004487,Vaginospasm,,HP:0030017,Vaginismus
C0278061,Abnormal mental state,abnormal mental state,,
C0154275,Selective immunoglobulin M deficiency,selective immunoglobulin m deficiency,,
C0154276,Other selective immunoglobulin deficiencies, selective immunoglobulin deficiencies,,
C0392440,Acquired acanthosis nigricans,acquired acanthosis nigricans,,
C0036400,Scimitar Syndrome,,HP:0005160,Total anomalous pulmonary venous return
C0475534,Anemia in neoplastic disease,anemia in neoplastic disease,,
C0034668,Forcible intercourse,forcible intercourse,,
C0869300,"Other joint derangement, NEC, involving forearm in MTHICD9_2014"," joint derangement, nec, involving forearm in mthicd9_2014",,
C0030326,Panniculitis,,HP:0012490,Panniculitis
C0576995,Bleeding of pharynx,bleeding of pharynx,,
C0158971,Neonatal jaundice associated with preterm delivery,neonatal jaundice associated ,,
C1719461,"Hypertensive chronic kidney disease, malignant, with chronic kidney disease stage V or end stage renal disease","hypertensive chronic kidney disease, malignant, ",,
C0266313,Allanson Pantzar McLeod syndrome,,HP:0008660,Renotubular dysgenesis
C0038054,"Sprue, Tropical","sprue, tropical",,
C1367972,Phlebitis and thrombophlebitis,phlebitis and thrombophlebitis,,
C0162301,Calculus in urethra,calculus in urethra,,
C0015645,Fasciitis,,HP:0100537,Fasciitis
C0155047,"Unqualified visual loss, both eyes","unqualified visual loss, both eyes",,
C0014511,Epithelial cyst,,HP:0200040,Epidermoid cyst
C0273433,Crushing injury of neck,crushing injury of neck,,
C0276156,Adenoviral pneumonia,adenoviral pneumonia,,
C0037317,Sleep disturbances,,HP:0002360,Sleep disturbance
C0037315,Sleep Apnea Syndromes,,HP:0010535,Sleep apnea
C0085614,First degree atrioventricular block,,HP:0011705,First degree atrioventricular block
C0398650,Immune thrombocytopenic purpura,immune thrombocytopenic purpura,,
C0027430,Nasal Polyps,,HP:0100582,Nasal polyposis
C0034372,Quadriplegia,,HP:0002445,Tetraplegia
C0524528,Pervasive Development Disorder,pervasive development disorder,,
C0577712,Pressure ulcer of hip,pressure ulcer of hip,,
C0577713,Pressure ulcer of ankle,pressure ulcer of ankle,,
C0577719,ulcer of calf,ulcer of calf,,
C0158124,Ankylosis of lower leg joint,ankylosis of lower leg joint,,
C0240310,Hypoplasia of the maxilla,,HP:0000327,Hypoplasia of the maxilla
C2937300,Congenital hereditary muscular dystrophy,congenital hereditary muscular dystrophy,,
C0029771,Other specified diseases of pancreas, specified diseases of pancreas,,
C1306306,Contracture of hip joint,contracture of hip joint,,
C0154132,"Neoplasm of unspecified nature of bone, soft tissue, and skin","neoplasm of  nature of bone, soft tissue, and skin",,
C0268329,Other and unspecified disorders of metabolism, and  disorders of metabolism,,
C1541850,Acquired arteriovenous aneurysm,acquired arteriovenous aneurysm,,
C0476431,Abnormal Karyotype,abnormal karyotype,,
C0032897,Prader-Willi Syndrome,prader-willi syndrome,,
C0002171,Alopecia Areata,,HP:0002229,Alopecia areata
C0002170,Alopecia,,HP:0001596,Alopecia
C0003123,Anorexia,,HP:0002039,Anorexia
C0040702,Transient Tic Disorder,transient tic disorder,,
C0154146,"Toxic nodular goiter, unspecified type, without mention of thyrotoxic crisis or storm","toxic nodular goiter,  type, ",,
C0154144,Toxic multinodular goiter without mention of thyrotoxic crisis or storm,toxic multinodular goiter ,,
C0740331,Immunodeficiency with increased immunoglobulin M,immunodeficiency ,,
C0026918,Mycobacterium Infections,mycobacterium infections,,
C0695252,Other malaise and fatigue, malaise and fatigue,,
C0695255,mechanical complication due to peritoneal dialysis catheter,mechanical complication due to peritoneal dialysis catheter,,
C0695257,Carrier or suspected carrier of other streptococcus,carrier or suspected carrier of  streptococcus,,
C0034494,Rabies (disorder),rabies (disorder),,
C0006277,Bronchitis,,HP:0012387,Bronchitis
C0868868,"Anomalies of foot, not elsewhere classified","anomalies of foot, not elsewhere classified",,
C0431614,Other specified anomalies of genital organs, specified anomalies of genital organs,,
