cui,cui_name,curated_name,hpo,hpo_name
C0154403,"Mild major depression, single episode","mild major depression, ",,
C0154954,Glaucoma associated with anomalies of iris,glaucoma associated ,,
C0024291,"Lymphohistiocytosis, Hemophagocytic","lymphohistiocytosis, hemophagocytic",,
C0154406,"Severe major depression, single episode, with psychotic features","severe major depression, , ",,
C0154405,"Severe major depression, single episode, without psychotic features","severe major depression, , ",,
C0154404,"Moderate major depression, single episode","moderate major depression, ",,
C0041849,"Infectious and parasitic diseases, unspecified","infectious and parasitic diseases, ",,
C0041847,Unspecified hypertrophic and atrophic conditions of skin, hypertrophic and atrophic conditions of skin,,
C0041844,Hemorrhoids without complication,hemorrhoids ,,
C0410385,"Acute osteomyelitis, other specified sites","acute osteomyelitis,  specified sites",,
C0041841,Unspecified gastritis and gastroduodenitis, gastritis and gastroduodenitis,,
C0036310,Scheuermann's Disease,,HP:0010891,Morbus Scheuermann
C0029857,Other testicular dysfunction, testicular dysfunction,,
C0029856,Other synovitis and tenosynovitis, synovitis and tenosynovitis,,
C0340422,Nutritional and metabolic cardiomyopathy,nutritional and metabolic cardiomyopathy,,
C0002625,Amnestic Disorder,amnestic disorder,,
C1443978,Pathological fracture of neck of femur,pathological fracture of neck of femur,,
C0260834,Radiotherapy follow-up,radiapy follow-up,,
C0156140,Hernia obstructive,hernia obstructive,,
C0156141,Other hernia of abdominal cavity without mention of obstruction or gangrene, hernia of abdominal cavity ,,
C0162275,Ketonuria,,HP:0002919,Ketonuria
C0156145,Incisional hernia without mention of obstruction or gangrene,incisional hernia ,,
C0156146,Crohn's disease of small intestine,crohn's disease of small intestine,,
C0156147,Crohn's disease of large bowel,crohn's disease of large bowel,,
C0162279,Choroidal detachment,choroidal detachment,,
C0015732,Fecal Incontinence,,HP:0002607,Bowel incontinence
C0014175,Endometriosis,,HP:0030127,Endometriosis
C0158474,Other acquired deformities of finger, acquired deformities of finger,,
C0158472,"Other acquired deformities of forearm, excluding fingers"," acquired deformities of forearm, excluding fingers",,
C0158473,Mallet finger,,HP:0030771,Mallet finger
C0158478,Acquired deformity of hip,acquired deformity of hip,,
C0156364,"Torsion of the ovary, ovarian pedicle or fallopian tube","torsion of the ovary, ovarian pedicle or fallopian tube",,
C0156366,"Other noninflammatory disorders of ovary, fallopian tube and broad ligament"," noninflammatory disorders of ovary, fallopian tube and broad ligament",,
C0156367,"Noninflammatory disorders of the ovary, fallopian tube and broad ligament","noninflammatory disorders of the ovary, fallopian tube and broad ligament",,
C0156361,Corpus luteum cyst or hematoma,corpus luteum cyst or hematoma,,
C0029673,Other noninfectious disorders of lymphatic channels, noninfectious disorders of lymphatic channels,,
C0158243,Thoracic spondylosis without myelopathy,thoracic spondylosis ,,
C0158782,Congenital anomaly of diaphragm,congenital anomaly of diaphragm,,
C0009043,"Simple dislocation, multiple and ill-defined sites","simple dislocation, multiple and ill-defined sites",,
C0003578,Apnea,,HP:0002104,Apnea
C0027726,Nephrotic Syndrome,,HP:0000100,Nephrotic syndrome
C2712629,Acute venous embolism and thrombosis of unspecified deep vessels of lower extremity,acute venous embolism and thrombosis of  deep vessels of lower extremity,,
C0027729,Nephrotic syndrome with other specified pathological lesion in kidney,nephrotic syndrome ,,
C0031069,Familial Mediterranean Fever,familial mediterranean fever,,
C2981140,Glaucoma of childhood,glaucoma of ,,
C0032781,Posterior rhinorrhea,posterior rhinorrhea,,
C0264039,Acute osteomyelitis of ankle and/or foot,acute osteomyelitis of ankle and/or foot,,
C0016708,Micturition frequency and polyuria,micturition frequency and polyuria,,
C0035258,Restless Legs Syndrome,,HP:0012452,Restless legs
C0436055,Other injury of chest wall, injury of chest wall,,
C0392502,Chronic gastrojejunal ulcer without hemorrhage AND without perforation,chronic gastrojejunal ulcer ,,
C0392503,Impaction of intestine,impaction of intestine,,
C0029839,Other specified urticaria, specified urticaria,,
C0029838,"Other specified types of schizophrenia, unspecified"," specified types of schizophrenia, ",,
C0029833,Other specified trematode infections, specified trematode infections,,
C0494574,"Hypertensive renal disease, unspecified, without mention of renal failure","hypertensive renal disease, , ",,
C0029834,Other specified trigeminal nerve disorders, specified trigeminal nerve disorders,,
C0029837,Other specified types of hydrocele, specified types of hydrocele,,
C0235756,Semen abnormal,semen abnormal,,
C0405580,Adrenal cortical hypofunction,adrenal cortical hypofunction,,
C0011849,Diabetes Mellitus,,HP:0000819,Diabetes mellitus
C0011848,Diabetes Insipidus,,HP:0000873,Diabetes insipidus
C0375076,"Lymphosarcoma, unspecified site, extranodal and solid organ sites","lymphosarcoma,  site, extranodal and solid organ sites",,
C0476228,"Localized superficial swelling, mass, or lump","localized superficial swelling, mass, or lump",,
C2733636,Other specified anomalies of unspecified limb, specified anomalies of  limb,,
C0392646,Herpes simplex without mention of complication,herpes simplex ,,
C0040412,Fissured tongue,,HP:0000221,Furrowed tongue
C0840805,Blisters with epidermal loss due to burn (second degree) of back (any part),blisters ,,
C0840804,Blisters with epidermal loss due to burn (second degree) of abdominal wall,blisters ,,
C0840802,Blisters with epidermal loss due to burn (second degree) of breast,blisters ,,
C0409274,"Unspecified joint derangement, pelvic region and thigh"," joint derangement, pelvic region and thigh",,
C0409277,Unspecified derangement of upper arm joint, derangement of upper arm joint,,
C0409276,Unspecified derangement of forearm joint, derangement of forearm joint,,
C0409271,"Unspecified joint derangement, multiple sites"," joint derangement, multiple sites",,
C0409273,"Unspecified joint derangement, ankle and foot"," joint derangement, ankle and foot",,
C0085694,Chronic cholecystitis,chronic cholecystitis,,
C2349630,"Ulcer of lower limbs, except pressure ulcer","ulcer of lower limbs, except pressure ulcer",,
C0085690,Internal hordeolum,,HP:0010608,Hordeolum internum
C0433981,Eyelid and lacrimal drainage system laceration,eyelid and lacrimal drainage system laceration,,
C0023892,Biliary cirrhosis,,HP:0002613,Biliary cirrhosis
C0023895,Liver diseases,liver diseases,,
C0002879,"Anemia, Hemolytic, Acquired","anemia, hemolytic, acquired",,
C0263809,Pathological dislocation of joint of lower leg,pathological dislocation of joint of lower leg,,
C0042485,Venous Insufficiency,,HP:0005293,Venous insufficiency
C1456141,Pressure ulcer of lower back,pressure ulcer of lower back,,
C0431725,Other specified anomalies of ureter, specified anomalies of ureter,,
C0155439,Acute suppurative otitis media in diseases classified elsewhere,acute suppurative otitis media in diseases classified elsewhere,,
C0037785,Specific developmental disorder,specific developmental disorder,,
C0751295,Memory Loss,memory loss,,
C1456144,Dental caries pit and fissure,dental caries pit and fissure,,
C0158545,Microphthalmos associated with other anomalies of eye AND/OR adnexa,microphthalmos associated ,,
C0393596,Drug-induced acute dystonia,drug-induced acute dystonia,,
C0155124,Other corneal degeneration, corneal degeneration,,
C0155120,"Corneal Dystrophy, Band-Shaped",,HP:0007709,Band-shaped corneal dystrophy
C0153876,Acute lymphoid leukemia in remission,acute lymphoid leukemia in remission,,
C0159099,Nonspecific abnormal electroencephalogram (EEG),nonspecific abnormal electroencephalogram (eeg),,
C0553604,Myotonic Disorders,myotonic disorders,,
C0024713,Manic Disorder,mania,,
C0008297,Choanal Atresia,,HP:0000453,Choanal atresia
C0267125,"Acute gastric ulcer without hemorrhage, without perforation AND without obstruction",acute gastric ulcer ,,
C0728936,Disorder of circulatory system,disorder of circulatory system,,
C0004352,Autistic Disorder,,HP:0000717,Autism
C0156771,"Unspecified complication of pregnancy, unspecified as to episode of care"," complication of pregnancy,  as to episode of care",,
C0375674,"Blisters, epidermal loss [second degree] of face and head, unspecified site","blisters, epidermal loss [second degree] of face and head,  site",,
C1263961,Disorder of pancreatic internal secretion,disorder of pancreatic internal secretion,,
C0040259,Tinea Pedis,tinea pedis,,
C0154632,Developmental speech or language disorder,delayed speech or language disorder,,
C0153248,Dermatophytosis of other specified sites,dermatophytosis of  specified sites,,
C0154633,Other developmental speech or language disorder, delayed speech or language disorder,,
C0042109,Urticaria,,HP:0001025,Urticaria
C0154634,Mixed development disorder,neurodevelopmental delay,,
C0153690,Secondary malignant neoplasm of bone,secondary malignant neoplasm of bone,,
C0494741,"Disease of stomach and duodenum, unspecified","disease of stomach and duodenum, ",,
C0343487,Streptococcal sore throat with scarlatina,streptococcal sore throat ,,
C0348455,Other hyperparathyroidism, hyperparathyroidism,,
C0003969,Ascorbic Acid Deficiency,,HP:0100510,Vitamin C deficiency
C0003962,Ascites,,HP:0001541,Ascites
C0949141,Intraventricular hemorrhage unspecified grade,intraventricular hemorrhage  grade,,
C0949142,"Intraventricular hemorrhage, grade I","intraventricular hemorrhage, grade i",,
C0949143,"Intraventricular hemorrhage, grade II","intraventricular hemorrhage, grade ii",,
C0949144,"Intraventricular hemorrhage, grade III","intraventricular hemorrhage, grade iii",,
C0949145,"Intraventricular hemorrhage, grade IV","intraventricular hemorrhage, grade iv",,
C0158718,Congenital dislocation of knee with genu recurvatum,congenital dislocation of knee ,,
C0158641,Congenital cystic lung,congenital cystic lung,,
C0235238,Cycloplegia,cycloplegia,,
C0158644,Congenital anomaly of lung,congenital anomaly of lung,,
C0158647,Unilateral complete cleft palate,unilateral complete cleft palate,,
C0158646,Cleft palate with cleft lip,cleft palate ,,
C0158649,Complete bilateral cleft palate,complete bilateral cleft palate,,
C0158648,Unilateral incomplete cleft palate,unilateral incomplete cleft palate,,
C0029442,Osteomalacia,,HP:0002749,Osteomalacia
C0029443,Osteomyelitis,,HP:0002754,Osteomyelitis
C0869256,Mixed urinary incontinence,mixed urinary incontinence,,
C0260784,Unspecified aftercare, aftercare,,
C0155332,Alternating exotropia with V pattern,alternating exotropia ,,
C0155333,Alternating exotropia with noncommitance other than A OR V pattern,alternating exotropia ,,
C0155330,Monocular exotropia with noncommitance other than A OR V pattern,monocular exotropia ,,
C0155336,Esotropia with accommodative compensation,esotropia ,,
C0029662,Other malignant lymphomas, malignant lymphomas,,
C0158255,Displacement of lumbar intervertebral disc without myelopathy,displacement of lumbar intervertebral disc ,,
C0155338,Total ophthalmoplegia,,HP:0007824,Total ophthalmoplegia
C0155339,Brown Tendon Sheath Syndrome,brown tendon sheath syndrome,,
C0029668,Other mucopurulent conjunctivitis, mucopurulent conjunctivitis,,
C0029669,Other musculoskeletal symptoms referable to limbs, musculoskeletal symptoms referable to limbs,,
C0271468,Eustachian tube disorder,eustachian tube disorder,,
C0027092,Myopia,,HP:0000545,Myopia
C0023976,Long QT Syndrome,long qt syndrome,,
C0270805,Hemiplegic cerebral palsy,hemiplegic cerebral palsy,,
C0155840,Hypertrophy of nasal turbinates,hypertrophy of nasal turbinates,,
C0155841,Cellulitis of pharynx or nasopharynx,cellulitis of pharynx or nasopharynx,,
C0155843,Retropharyngeal Abscess,retropharyngeal abscess,,
C0155844,Pharynx or nasopharynx edema,pharynx or nasopharynx edema,,
C0155845,Pharynx or nasopharynx cyst,pharynx or nasopharynx cyst,,
C0155847,Unilateral partial vocal cord paralysis,unilateral  vocal cord paralysis,,
C0155848,Unilateral total vocal cord paralysis,unilateral total vocal cord paralysis,,
C0155849,Bilateral partial vocal cord paralysis,bilateral  vocal cord paralysis,,
C0153066,Murray valley encephalitis,murray valley encephalitis,,
C0159120,Nonspecific abnormal results of other specified function study,nonspecific abnormal results of  specified function study,,
C0159125,Culture positive,culture positive,,
C0154421,"Bipolar I disorder, most recent episode (or current) manic, in partial or unspecified remission","bipolar disorder,  ",,
C0154420,"Bipolar I disorder, most recent episode (or current) manic, severe, specified as with psychotic behavior","bipolar disorder,  severe, specified as ",,
C0154425,"Bipolar I disorder, most recent episode (or current) depressed, moderate","bipolar disorder,  moderate",,
C0154427,"Bipolar I disorder, most recent episode (or current) depressed, severe, specified as with psychotic behavior","bipolar disorder,  severe, specified as ",,
C0154426,"Bipolar I disorder, most recent episode (or current) depressed, severe, without mention of psychotic behavior","bipolar disorder,  severe, ",,
C0154429,"Bipolar affective disorder, depressed, in full remission","bipolar affective disorder, in full remission",,
C0154428,"Bipolar I disorder, most recent episode (or current) depressed, in partial or unspecified remission","bipolar disorder,  ",,
C0154451,"Other specified pervasive developmental disorders, current or active state"," specified pervasive developmental disorders, ",,
C0041825,Disorder of tympanic membrane,disorder of tympanic membrane,,
C0041827,Unspecified disorders of menstruation and other abnormal bleeding from female genital tract, disorders of menstruation and  abnormal bleeding from female genital tract,,
C0036337,Schizoaffective Disorder,schizoaffective disorder,,
C0036339,Schizoid Personality Disorder,schizoid personality disorder,,
C0340443,Acute pericarditis in diseases classified elsewhere,acute pericarditis in diseases classified elsewhere,,
C0410332,Articular cartilage disorder of the pelvic region and thigh,articular cartilage disorder of the pelvic region and thigh,,
C0260812,Person awaiting admission to adequate facility elsewhere,person awaiting admission to adequate facility elsewhere,,
C0260813,Other specified reasons for unavailability of medical facilities, specified reasons for unavailability of medical facilities,,
C1456292,Drug-induced sleep disorder,drug-induced sleep disorder,,
C1456296,Delirium due to conditions classified elsewhere,delirium due to conditions classified elsewhere,,
C1456297,Psychotic disorder with delusions in conditions classified elsewhere,psychotic disorder ,,
C1456298,Mood disorder in conditions classified elsewhere,depression in conditions classified elsewhere,,
C1456299,Anxiety disorder in conditions classified elsewhere,anxiety disorder in conditions classified elsewhere,,
C0156166,Diverticulosis of colon (without mention of haemorrhage),diverticulosis of colon (,,
C0156167,Diverticulitis of colon (without mention of haemorrhage),diverticulitis of colon (,,
C0153990,Benign neoplasm of other specified sites of skin,benign neoplasm of  specified sites of skin,,
C0153999,Benign neoplasm of uterus,benign neoplasm of uterus,,
C0157697,Cellulitis and abscess of neck,cellulitis and abscess of neck,,
C0157696,Cellulitis and abscess of face,cellulitis and abscess of face,,
C0157695,Other cellulitis and abscess, cellulitis and abscess,,
C0157694,Onychia and paronychia of toe,onychia and paronychia of toe,,
C0157693,Cellulitis and abscess of toe,cellulitis and abscess of toe,,
C0600427,Cocaine Dependence,cocaine dependence,,
C0157691,Cellulitis and abscess of finger,cellulitis and abscess of finger,,
C0157699,Cellulitis and abscess of upper arm and forearm,cellulitis and abscess of upper arm and forearm,,
C0157698,Cellulitis and abscess of trunk,cellulitis and abscess of trunk,,
C0276774,Protozoal intestinal disease,protozoal intestinal disease,,
C0152861,Tuberculosis of peripheral lymph nodes,tuberculosis of peripheral lymph nodes,,
C0156345,Endometriosis of pelvic peritoneum,endometriosis of pelvic peritoneum,,
C0022362,Jaw Diseases,jaw diseases,,
C0496955,Neoplasm of uncertain or unknown behavior of skin,neoplasm of uncertain or unknown behavior of skin,,
C0017980,"Glycosuria, Renal","glycosuria, renal",,
C0027703,"Nephritis and nephropathy, not specified as acute or chronic, with unspecified pathological lesion in kidney","nephritis and nephropathy, not specified as acute or chronic, ",,
C0027702,Nephritis NEC in ICD9CM_2014,nephritis,,
C0375794,"Infection with drug-resistant microorganisms, unspecified, with multiple drug resistance",infection ,,
C0375790,Infection with microorganisms without mention of resistance to multiple drugs,infection ,,
C0023798,Lipoma,,HP:0012032,Lipoma
C0375793,"Infection with drug-resistant microorganisms, unspecified, without mention of multiple drug resistance",infection ,,
C0085622,Monoplegia,monoplegia,,
C1135284,Aftercare for healing traumatic fracture of lower leg,aftercare for healing traumatic fracture of lower leg,,
C1135286,Aftercare for healing traumatic fracture of other bone,aftercare for healing traumatic fracture of  bone,,
C0161744,Otitic barotrauma,otitic barotrauma,,
C1135280,Aftercare for healing traumatic fracture of lower arm,aftercare for healing traumatic fracture of lower arm,,
C0017181,Gastrointestinal Hemorrhage,,HP:0002239,Gastrointestinal hemorrhage
C0017183,Gastrointestinal malfunction arising from mental factors,gastrointestinal malfunction ,,
C0017327,Generalized atherosclerosis,generalized atherosclerosis,,
C0476346,Feces contents abnormal,feces contents abnormal,,
C1442831,Other and unspecified arthropathies, and  arthropathies,,
C2349432,"Migraine with aura, without mention of intractable migraine without mention of status migrainosus",migraine ,,
C2349433,"Migraine with aura, with intractable migraine, so stated, without mention of status migrainosus",migraine ,,
C0029858,Other testicular hypofunction, testicular hypofunction,,
C2349438,"Migraine without aura, without mention of intractable migraine without mention of status migrainosus",migraine ,,
C2349439,"Migraine without aura, with intractable migraine, so stated, without mention of status migrainosus",migraine ,,
C0029855,Other symptoms involving head and neck, symptoms involving head and neck,,
C0029854,Other symptoms involving cardiovascular system, symptoms involving cardiovascular system,,
C0271813,Fibrous autoimmune thyroiditis,fibrous autoimmune thyroiditis,,
C0476206,Dizziness and giddiness symptoms,dizziness and giddiness symptoms,,
C0917981,Progressive Muscular Atrophy,progressive muscular atrophy,,
C2243087,Acute hemorrhagic gastritis,acute hemorrhagic gastritis,,
C0410693,Other curvatures of spine, curvatures of spine,,
C0238074,Chronic pulmonary heart disease,chronic pulmonary heart disease,,
C0854248,Pneumonia due to Gram negative bacteria,pneumonia due to gram negative bacteria,,
C0260576,"Procreative management, unspecified","procreative management, ",,
C0234428,Disturbance of consciousness,,HP:0004372,Reduced consciousness/confusion
C0154856,Retinal lattice degeneration,,HP:0007992,Lattice retinal degeneration
C0260702,Dependence on other enabling machines,dependence on  enabling machines,,
C0431705,Other specified cystic kidney disease, specified cystic kidney disease,,
C0155454,Recurrent cholesteatoma of postmastoidectomy cavity,recurrent cholesteatoma of postmastoidectomy cavity,,
C0155452,Postmastoidectomy complication,postmastoidectomy complication,,
C0260808,Unspecified psychosocial circumstance, psychosocial circumstance,,
C0340589,Embolism and thrombosis of arteries of lower extremities,embolism and thrombosis of arteries of lower extremities,,
C0342981,Degenerative skin disorder,degenerative skin disorder,,
C0153850,"Other malignant lymphomas, lymph nodes of head, face, and neck"," malignant lymphomas, lymph nodes of head, face, and neck",,
C0156179,"Suppurative peritonitis, other","suppurative peritonitis, ",,
C0238425,Hemoglobin SS disease with crisis,hemoglobin ss disease ,,
C0001541,Adjustment disorder with mixed disturbance of emotions AND conduct,adjustment disorder ,,
C0001540,Adjustment disorder with disturbance of conduct,adjustment disorder ,,
C0150045,Urge Incontinence,urge incontinence,,
C0025287,Meningism,meningism,,
C0236151,Renal function tests abnormal,renal function tests abnormal,,
C0025289,Meningitis,,HP:0001287,Meningitis
C0042341,Varicocele,,HP:0012871,Varicocele
C0152105,Hypertensive heart disease,hypertensive heart disease,,
C0152459,Linear atrophy,,HP:0001065,Striae distensae
C0019919,Hordeolum externum,,HP:0010607,Hordeolum externum
C0153509,Malignant tumor of bone and articular cartilage,malignant tumor of bone and articular cartilage,,
C0026393,Molluscum Contagiosum,molluscum contagiosum,,
C0866710,Acquired hallux varus,acquired hallux varus,,
C0311223,Frozen shoulder,frozen shoulder,,
C0343175,"Pyogenic arthritis, site unspecified","pyogenic arthritis, site ",,
C0153984,Benign neoplasm of ear and external auditory canal,benign neoplasm of ear and external auditory canal,,
C0028734,Nocturia,,HP:0000017,Nocturia
C0155811,Acute laryngitis and/or tracheitis,acute laryngitis and/or tracheitis,,
C0040188,Tic disorder,tic disorder,,
C0028738,Nystagmus,,HP:0000639,Nystagmus
C0347854,Enteritis due to rotavirus,enteritis due to rotavirus,,
C0002018,Alexia,,HP:0010523,Alexia
C0002019,Dyslexia and alexia,dyslexia,,
C0496899,"Benign neoplasm of brain, unspecified","benign neoplasm of brain, ",,
C2911205,Long term (current) use of aspirin,long term (current) use of aspirin,,
C0042842,Vitamin A Deficiency,,HP:0004905,Vitamin A deficiency
C0496891,Benign neoplasm of male genital organ,benign neoplasm of male genital organ,,
C0496897,"Benign neoplasm of eye, unspecified","benign neoplasm of eye, ",,
C0029560,Other conjunctivitis, conjunctivitis,,
C0263687,Pyogenic arthritis involving lower leg,pyogenic arthritis involving lower leg,,
C0338930,Acute hysterical psychosis,acute hysterical psychosis,,
C0949160,Fall resulting in striking against other object,fall resulting in striking against  object,,
C0026703,Mucopolysaccharidoses,mucopolysaccharidoses,,
C0154713,"Partial epilepsy, with impairment of consciousness, with intractable epilepsy"," epilepsy, ",,
C0158623,Congenital anomaly of coronary artery,,HP:0006704,Abnormality of the coronary arteries
C0158621,Congenital subaortic stenosis,congenital subaortic stenosis,,
C0160371,injury of rectum with open wound into cavity,injury of rectum ,,
C0158629,Congenital anomaly of aortic arch,congenital anomaly of aortic arch,,
C2712988,Acute kidney failure with other specified pathological lesion in kidney,acute kidney failure ,,
C0158407,"Periostitis, without mention of osteomyelitis, multiple sites","periostitis, ",,
C0154717,"Epilepsia partialis continua, without mention of intractable epilepsy","epilepsia is continua, ",,
C0158405,"Periostitis, without mention of osteomyelitis, involving lower leg","periostitis, ",,
C0154247,Other disturbances of straight-chain amino-acid metabolism, disturbances of straight-chain amino-acid metabolism,,
C0154246,"Urea Cycle Disorders, Inborn","urea cycle disorders, inborn",,
C1961834,"Chronic peptic ulcer of unspecified site without mention of hemorrhage or perforation, without mention of obstruction",chronic peptic ulcer of  site ,,
C0041636,Umbilical hernia without mention of obstruction or gangrene,umbilical hernia ,,
C2242765,Acquired spondylolisthesis,acquired spondylolisthesis,,
C0490007,Other specified hypotension, specified hypotension,,
C0029640,Other impaction of intestine, impaction of intestine,,
C0477341,"Encephalitis, myelitis and encephalomyelitis in viral diseases classified elsewhere","encephalitis, myelitis and encephalomyelitis in viral diseases classified elsewhere",,
C0153251,Candidiasis of lung,candidiasis of lung,,
C0007820,Cerebrovascular Disorders,cerebrovascular disorders,,
C0007286,Carpal Tunnel Syndrome,carpal tunnel syndrome,,
C0375133,diabetes with renal manifestations type 1 uncontrolled,diabetes ,,
C0375135,"Diabetes with ophthalmic manifestations, type I [juvenile type], not stated as uncontrolled",diabetes ,,
C0154623,Unspecified emotional disturbance of childhood or adolescence, emotional disturbance ,,
C0154190,Post-surgical hypoinsulinemia,post-surgical hypoinsulinemia,,
C0154621,Academic underachievement disorder of childhood or adolescence,academic underachievement disorder ,,
C0154192,Other specified disorders of pancreatic internal secretion, specified disorders of pancreatic internal secretion,,
C0154627,hyperkinesis of childhood with developmental delay,hyperkinesis of  ,,
C0154198,Iatrogenic pituitary disorder,iatrogenic pituitary disorder,,
C0154629,Other specified manifestations of hyperkinetic syndrome, specified manifestations of hyperkinetic syndrome,,
C0154628,Hyperkinetic conduct disorder of childhood,hyperkinetic oppositional defiant disorder of ,,
C0155865,Pneumonia in pertussis,pneumonia in pertussis,,
C0155862,Streptococcal pneumonia,streptococcal pneumonia,,
C0155860,Pneumonia due to Pseudomonas,pneumonia due to pseudomonas,,
C0477961,Other specified conditions of integument specific to fetus and newborn, specified conditions of integument specific to fetus and newborn,,
C0155869,Pneumonia in other infectious diseases classified elsewhere,pneumonia in  infectious diseases classified elsewhere,,
C0159100,Other nonspecific abnormal results of function study of brain and central nervous system, nonspecific abnormal results of function study of brain and central nervous system,,
C0159106,Oculomotor study abnormal,oculomotor study abnormal,,
